<!ENTITY % link_attrs 
	"from CDATA #IMPLIED
	 to CDATA #IMPLIED
	 condition CDATA #IMPLIED
	 val CDATA #IMPLIED">

<!ELEMENT machine (import*,init,def,conf+,((cur?,listener?)|(listener?,cur?)))>
<!ELEMENT init (state)>
<!ELEMENT def (state*)>
<!ELEMENT state (action?,link*) >
<!ELEMENT conf (link+)>
<!ELEMENT link (property*)>
<!ELEMENT cur (#PCDATA)>
<!ELEMENT listener (property*)>
<!ELEMENT import (#PCDATA)>
<!ELEMENT property (#PCDATA)>
<!ELEMENT action (property*)>
<!ATTLIST machine judgement CDATA #IMPLIED>
<!ATTLIST state 
	name CDATA #REQUIRED
	action CDATA #IMPLIED
	>

<!ATTLIST conf %link_attrs;>

<!ATTLIST link %link_attrs;>

<!ATTLIST listener class CDATA #IMPLIED>
<!ATTLIST property name CDATA #REQUIRED >
<!ATTLIST property ref CDATA #IMPLIED >
<!ATTLIST property value CDATA #IMPLIED >
<!ATTLIST action class CDATA #IMPLIED>
