<?xml version="1.0" encoding="utf-8"?>
<!DOCTYPE machine PUBLIC "" "src/test/resources/machine.dtd">
<machine>
	<import>y1j2x34.state.action.*</import>
	<import>y1j2x34.state.*</import>
	<init>
		<state name="walk" action="WalkSportAction"></state>
	</init>
	<def>
		<state name="run" action="RunSportAction"/>
		<state name="jump" action="JumpSportAction"/>
		<state name="dance" >
			<action class="DanceSportAction">
				<property name="danceName"/>
			</action>
		</state>
	</def>
	<conf val=".*" guards="RegexGuards" from="walk">
		<link to="run" val="\d+"/>
		<link to="jump" />
		<link to="dance" >
			<property name="haha" ref="haha"/>
		</link>
	</conf>
	
	<cur>dance</cur>
</machine>